{
  "$schema": "csharp-14.schema.json",
  "baseline": {
    "language": "C#",
    "languageVersion": "14",
    "framework": ".NET 10",
    "roslynVersion": "5.9.0",
    "newestLanguageVersion": "CSharp14"
  },
  "families": [
    {
      "id": "compilation-and-names",
      "name": "Files, namespaces and imports"
    },
    {
      "id": "type-declarations",
      "name": "Type definitions and relationships"
    },
    {
      "id": "members-and-modifiers",
      "name": "Members and declaration modifiers"
    },
    {
      "id": "types-and-signatures",
      "name": "Type shapes and signatures"
    },
    {
      "id": "literals-and-expressions",
      "name": "Values and expression operators"
    },
    {
      "id": "calls-and-construction",
      "name": "Calls, creation and initialization"
    },
    {
      "id": "variables-and-patterns",
      "name": "Variables, matching and deconstruction"
    },
    {
      "id": "structured-statements",
      "name": "Control flow statements"
    },
    {
      "id": "exceptions-and-lifetime",
      "name": "Exception handling and resource scopes"
    },
    {
      "id": "callables-and-closures",
      "name": "Callable bodies and captured values"
    },
    {
      "id": "asynchrony-and-iteration",
      "name": "Awaiting and sequence traversal"
    },
    {
      "id": "queries-and-dynamic",
      "name": "Queries, expression trees and dynamic calls"
    },
    {
      "id": "memory-and-interop",
      "name": "Memory access and interoperation"
    },
    {
      "id": "compile-time-metadata",
      "name": "Attributes, directives and compiler metadata"
    },
    {
      "id": "generated-and-partial",
      "name": "Generated source and declaration provenance"
    },
    {
      "id": "csharp-14-additions",
      "name": "C# 14 feature additions"
    }
  ],
  "features": [
    {
      "id": "compilation-units",
      "family": "compilation-and-names",
      "name": "Source file roots",
      "languageVersion": "1",
      "plannedMaturity": "structural",
      "syntaxKinds": [
        "CompilationUnit"
      ],
      "dimensions": {
        "preserve": {
          "status": "unverified"
        },
        "render": {
          "status": "unverified"
        },
        "dedicatedAuthoring": {
          "status": "unverified"
        },
        "semanticValidation": {
          "status": "unverified"
        },
        "debugMapping": {
          "status": "unverified"
        },
        "traceObservation": {
          "status": "unverified"
        }
      }
    },
    {
      "id": "names-and-aliases",
      "family": "compilation-and-names",
      "name": "Identifier paths and aliases",
      "languageVersion": "1",
      "plannedMaturity": "structural",
      "syntaxKinds": [
        "IdentifierName",
        "QualifiedName",
        "NameEquals"
      ],
      "dimensions": {
        "preserve": {
          "status": "unverified"
        },
        "render": {
          "status": "unverified"
        },
        "dedicatedAuthoring": {
          "status": "unverified"
        },
        "semanticValidation": {
          "status": "unverified"
        },
        "debugMapping": {
          "status": "unverified"
        },
        "traceObservation": {
          "status": "unverified"
        }
      }
    },
    {
      "id": "generic-names",
      "family": "compilation-and-names",
      "name": "Names with type arguments",
      "languageVersion": "2",
      "plannedMaturity": "structural",
      "syntaxKinds": [
        "GenericName",
        "TypeArgumentList"
      ],
      "dimensions": {
        "preserve": {
          "status": "unverified"
        },
        "render": {
          "status": "unverified"
        },
        "dedicatedAuthoring": {
          "status": "unverified"
        },
        "semanticValidation": {
          "status": "unverified"
        },
        "debugMapping": {
          "status": "unverified"
        },
        "traceObservation": {
          "status": "unverified"
        }
      }
    },
    {
      "id": "namespace-declarations",
      "family": "compilation-and-names",
      "name": "Namespace blocks",
      "languageVersion": "1",
      "plannedMaturity": "structural",
      "syntaxKinds": [
        "NamespaceDeclaration"
      ],
      "dimensions": {
        "preserve": {
          "status": "unverified"
        },
        "render": {
          "status": "unverified"
        },
        "dedicatedAuthoring": {
          "status": "unverified"
        },
        "semanticValidation": {
          "status": "unverified"
        },
        "debugMapping": {
          "status": "unverified"
        },
        "traceObservation": {
          "status": "unverified"
        }
      }
    },
    {
      "id": "file-scoped-namespaces",
      "family": "compilation-and-names",
      "name": "Namespace headers",
      "languageVersion": "10",
      "plannedMaturity": "structural",
      "syntaxKinds": [
        "FileScopedNamespaceDeclaration"
      ],
      "dimensions": {
        "preserve": {
          "status": "unverified"
        },
        "render": {
          "status": "unverified"
        },
        "dedicatedAuthoring": {
          "status": "unverified"
        },
        "semanticValidation": {
          "status": "unverified"
        },
        "debugMapping": {
          "status": "unverified"
        },
        "traceObservation": {
          "status": "unverified"
        }
      }
    },
    {
      "id": "using-directives",
      "family": "compilation-and-names",
      "name": "Namespace imports and alias directives",
      "languageVersion": "1",
      "plannedMaturity": "structural",
      "syntaxKinds": [
        "UsingDirective"
      ],
      "dimensions": {
        "preserve": {
          "status": "unverified"
        },
        "render": {
          "status": "unverified"
        },
        "dedicatedAuthoring": {
          "status": "unverified"
        },
        "semanticValidation": {
          "status": "unverified"
        },
        "debugMapping": {
          "status": "unverified"
        },
        "traceObservation": {
          "status": "unverified"
        }
      }
    },
    {
      "id": "extern-aliases",
      "family": "compilation-and-names",
      "name": "External assembly aliases",
      "languageVersion": "2",
      "plannedMaturity": "structural",
      "syntaxKinds": [
        "ExternAliasDirective",
        "AliasQualifiedName"
      ],
      "dimensions": {
        "preserve": {
          "status": "unverified"
        },
        "render": {
          "status": "unverified"
        },
        "dedicatedAuthoring": {
          "status": "unverified"
        },
        "semanticValidation": {
          "status": "unverified"
        },
        "debugMapping": {
          "status": "unverified"
        },
        "traceObservation": {
          "status": "unverified"
        }
      }
    },
    {
      "id": "static-imports",
      "family": "compilation-and-names",
      "name": "Static member imports",
      "languageVersion": "6",
      "plannedMaturity": "structural",
      "syntaxKinds": [],
      "dimensions": {
        "preserve": {
          "status": "unverified"
        },
        "render": {
          "status": "unverified"
        },
        "dedicatedAuthoring": {
          "status": "unverified"
        },
        "semanticValidation": {
          "status": "unverified"
        },
        "debugMapping": {
          "status": "unverified"
        },
        "traceObservation": {
          "status": "unverified"
        }
      }
    },
    {
      "id": "global-imports",
      "family": "compilation-and-names",
      "name": "Imports shared across files",
      "languageVersion": "10",
      "plannedMaturity": "structural",
      "syntaxKinds": [],
      "dimensions": {
        "preserve": {
          "status": "unverified"
        },
        "render": {
          "status": "unverified"
        },
        "dedicatedAuthoring": {
          "status": "unverified"
        },
        "semanticValidation": {
          "status": "unverified"
        },
        "debugMapping": {
          "status": "unverified"
        },
        "traceObservation": {
          "status": "unverified"
        }
      }
    },
    {
      "id": "file-local-types",
      "family": "compilation-and-names",
      "name": "Types scoped to one file",
      "languageVersion": "11",
      "plannedMaturity": "structural",
      "syntaxKinds": [],
      "dimensions": {
        "preserve": {
          "status": "unverified"
        },
        "render": {
          "status": "unverified"
        },
        "dedicatedAuthoring": {
          "status": "unverified"
        },
        "semanticValidation": {
          "status": "unverified"
        },
        "debugMapping": {
          "status": "unverified"
        },
        "traceObservation": {
          "status": "unverified"
        }
      }
    },
    {
      "id": "top-level-statements",
      "family": "compilation-and-names",
      "name": "Entry point statements outside a type",
      "languageVersion": "9",
      "plannedMaturity": "structural",
      "syntaxKinds": [
        "GlobalStatement"
      ],
      "dimensions": {
        "preserve": {
          "status": "unverified"
        },
        "render": {
          "status": "unverified"
        },
        "dedicatedAuthoring": {
          "status": "unverified"
        },
        "semanticValidation": {
          "status": "unverified"
        },
        "debugMapping": {
          "status": "unverified"
        },
        "traceObservation": {
          "status": "unverified"
        }
      }
    },
    {
      "id": "using-type-aliases",
      "family": "compilation-and-names",
      "name": "Aliases for additional type forms",
      "languageVersion": "12",
      "plannedMaturity": "structural",
      "syntaxKinds": [],
      "dimensions": {
        "preserve": {